{
    "Title": "Example Calibration",
    "Geometry": {
        "Tilt": {
            "TiltAngleDeg": -10,
            "TiltRotDeg": 73.569
        },
        "DedectorDistanceMM": 1031.657,
        "BeamCenter": [
            808.37,
            387.772
        ],
        "Imagesize": [
            1043,
            981
        ],
        "PixelSizeMicroM": [
            172.0,
            172.0
        ]
    },
    "Directory": [
        "."
    ],
    "Masks": [
        {
            "PixelPerRadialElement": 1,
            "MaskFile": "emptymask.tif",
            "Oversampling": 2,
            "Name": "",
            "Phi-mode": false,
            "qStart": 0.0, 
            "qStop": 5.0
        }],
    "Slices": [],
    "GISAXSmode": false,
    "Wavelength": 1.54,
    "Live-Filelisting": true,
    "OverwriteFiles": true,
    "Threads": 2
}